{
  "schemaVersion": "1.0",
  "examId": "pungyang-middle-2026-g3-s1-final",
  "school": {
    "id": "pungyang-middle",
    "name": "풍양중학교"
  },
  "academicYear": 2026,
  "grade": 3,
  "semester": 1,
  "examType": {
    "id": "final",
    "name": "기말고사",
    "sourceLabel": "2차 정기시험"
  },
  "subject": "수학",
  "summary": {
    "totalQuestions": 21,
    "totalScore": 100,
    "classification": "Observed Fact"
  },
  "questionFormat": [
    {
      "id": "selected-response",
      "name": "선택형",
      "questions": 17,
      "score": 80,
      "classification": "Observed Fact"
    },
    {
      "id": "constructed-response",
      "name": "논술형",
      "questions": 4,
      "score": 20,
      "classification": "Observed Fact"
    }
  ],
  "units": [
    {
      "id": "quadratic-equations",
      "name": "이차방정식",
      "questions": 9,
      "questionPercentage": 42.9,
      "score": 40,
      "scorePercentage": 40,
      "classification": "Structured / Calculated Data"
    },
    {
      "id": "factorization",
      "name": "인수분해",
      "questions": 5,
      "questionPercentage": 23.8,
      "score": 26,
      "scorePercentage": 26,
      "classification": "Structured / Calculated Data"
    },
    {
      "id": "statistics",
      "name": "통계",
      "questions": 7,
      "questionPercentage": 33.3,
      "score": 34,
      "scorePercentage": 34,
      "classification": "Structured / Calculated Data"
    }
  ],
  "difficulty": {
    "classification": "Academy Analysis",
    "disclosure": "수학의 기준 자체 분석 기준이며 학교의 공식 난이도 분류가 아닙니다.",
    "method": "분석 보고서의 문항별 난이도 표를 집계하고, 정의된 난이도 기준이 각 문항의 풀이 과정과 충돌하지 않는지 원본 시험지와 다시 확인했습니다.",
    "criteria": [
      {
        "id": "low",
        "name": "하",
        "definition": "기본 개념 또는 기본 공식 적용 중심"
      },
      {
        "id": "medium",
        "name": "중",
        "definition": "개념 결합 또는 조건 해석 필요"
      },
      {
        "id": "high",
        "name": "상",
        "definition": "복합 조건 또는 다단계 사고 필요"
      }
    ],
    "levels": [
      {
        "id": "high",
        "name": "상",
        "questions": 6,
        "questionPercentage": 28.6
      },
      {
        "id": "medium",
        "name": "중",
        "questions": 10,
        "questionPercentage": 47.6
      },
      {
        "id": "low",
        "name": "하",
        "questions": 5,
        "questionPercentage": 23.8
      }
    ]
  },
  "calculatedMetrics": {
    "classification": "Structured / Calculated Data",
    "questionPercentageDecimals": 1,
    "scorePercentageDecimals": 0,
    "roundingPolicy": "문항 비율은 소수점 첫째 자리, 배점 비율은 정수로 반올림합니다."
  },
  "analysis": {
    "classification": "Academy Analysis",
    "summary": [
      "수학의 기준 자체 분석에서는 난이도를 상 6문항, 중 10문항, 하 5문항으로 분류했습니다.",
      "상 난이도 분류에는 인수분해 응용, 이차방정식 활용, 통계의 복합 조건을 다루는 문항이 포함됐습니다."
    ]
  },
  "recommendations": {
    "classification": "Recommendation",
    "items": [
      "인수분해는 공통인수와 여러 공식의 적용 순서를 점검합니다.",
      "이차방정식은 식을 세우는 활용 문제까지 풀이 과정을 반복합니다.",
      "통계는 평균·중앙값·최빈값과 표준편차의 정의를 조건과 연결해 연습합니다.",
      "논술형 4문항 20점에 대비해 풀이 근거를 단계별로 쓰는 연습을 합니다."
    ]
  },
  "provenance": {
    "analysisMethod": "원본 PDF 4페이지 전체에서 문항 번호·배점·형식을 직접 대조하고, 문항 내용과 구조화 단원 분류를 문항별로 교차 확인했습니다. 난이도는 분석 보고서의 문항별 표를 정의된 기준에 따라 별도로 재검토했습니다.",
    "analysisDate": "2026-07-18",
    "publicDataGeneratedAt": "2026-09-22",
    "reviewedAt": "2026-09-26",
    "reviewedBy": "academy-director",
    "humanReviewed": true,
    "sourceVerification": {
      "structuredDataReviewed": true,
      "reportReviewed": true,
      "originalExamPdfReviewed": true,
      "originalExamPdfSha256": "f02f23439c25ef3e2ed619bfc0f1e30f98b18f0d9eacf4e862c75d573883f466"
    }
  }
}
